is_soft_skill,soft_skill,context
1,able to multitask,excellent organisational skill and xxx xxx xxx
1,team member,look for to work a a xxx xxx with hilton hotel s
1,verbal communication skills,"to detail and accuracy , fantastic write and xxx xxx xxx then this be may"
0,dynamic,for an experience and dedicate ict manager to join an xxx ict team
0,dynamic,"this be a unique , xxx and challenge role that will both test and develop your"
0,independent,the home be an xxx care home with a great reputation for deliver high standard
1,lively,"for career development in a professional , xxx stimulate environment"
0,dynamic,the service desk be a busy and xxx team who be the central and 1st contact for our
0,lively,this role will join a lean but xxx team produce only the highest quality market campaign
0,team working,net developer to join their friendly and hardworking development xxx xxx on excite new project a they grow their software
0,team working,"own division and you will join a friendly , professional xxx xxx in a fun , yet mature and non kpi"
1,educational and care skills,"opportunity , where you can combine your xxx xxx xxx xxx"
0,dynamic,in touch recruitment be work on behalf of a xxx care provider to recruit an experience night nurse rgn
0,team working,"you will be part of a xxx xxx various shift include day , even , weekend"
1,project management skills,international medical education strong medical education xxx xxx xxx include attention to detail and
1,willing to travel,"self starter who thrive on challenge xxx xxx xxx in uk , europe and worldwide"
0,dynamic,the jam hornsby school in basildon in essex require a xxx and outstanding teacher of business study and ict to join
0,dynamic,"interactive designer , you will work a part of a xxx creative team create design for user interface , advertise and"
0,dynamic,a xxx personality be essential cad experience be also essential liaise with
0,dynamic,the customer base be a xxx retail sector where supply availability and service level be crucial
0,independent,this wellestablished xxx pharmaceutical organisation base in the south east of england be
0,dynamic,opportunity to embrace an fc role in a grow and xxx company with the prospect of develop this role into become
1,public speaking skills,strategy teamwork and leadership ability motivational informative xxx xxx xxx human resource management public
1,analytical and numerical abilities,"fraud function , or in a similar role xxx xxx xxx xxx experience of use a crm"
1,efficient,work effectively with manager to ensure the xxx run of store team
1,openminded,empathy and tolerance ethical behaviour responsibility xxx selfconfidence ambition customerorientation professional appearance
0,dynamic,and who want to be part of a progressive and xxx pr agency
0,dynamic,"a fast grow , xxx travel company be look to employ a customer relation advisor"
0,dynamic,"purpose statement a highly xxx regional role , with focus on sell strategic advertise program"
1,able to communicate,photocopier etc in school experience require be xxx xxx xxx well at all level
1,hard worker,"retail , estate agency , telesales xxx xxx ambitious , drive and target"
1,work under stress,ability to xxx xxx xxx condition
0,dynamic,"due to the xxx nature of the group environment , the ideal candidate will"
1,personal management skills,nbsp nbsp self starter with good xxx xxx xxx
0,dynamic,car mobile phonemilton keynes be you an experience xxx outbound sale person if so then this be the
1,work of others in a small team,ability to co ordinate the xxx xxx xxx xxx xxx xxx xxx analytical skill
0,lively,fun yet professional and you will be part of a xxx sale team that be focus and enthusiastic
1,attention to detail contact details,numerate accurate team player organise keen xxx xxx xxx xxx xxx if you be interest please
0,dynamic,senior finance be currently recruit on behalf of a large xxx household name in malmesbury
0,aggressive,experience ability to be assertive and persuasive without be too xxx great verbal and write communication skill excellent time management skill
0,dynamic,be involve in some of the uk most complex and xxx project and come from an it or telecommunication background we
0,lively,"shine through every interaction by show a xxx interest in customer , have a natural approach in communication"
1,written communication skills,numerical and it skill good speak and xxx xxx xxx an organise and methodical
1,team building skills,demonstrate the follow skill excellent interpersonal skill xxx xxx xxx analytical and problem solve skill
0,team working,you will be a member of a small engineer xxx xxx a continental s skill main duty you will
1,results driven,xxx xxx dynamic in approach
0,independent,com be the uk s lead xxx retailer of train ticket online
1,counselling skills,"transferrable skill to support other service ie xxx xxx wind care , ensure all"
1,personable,be xxx approachable and professional
0,versatility,"product each year , demonstrate the outstanding xxx of the venue"
0,dynamic,", linux javascript ajax html xml cs experience with xxx databasedriven website it relate degree this position offer you the"
1,project management,will involve a significant amount of xxx xxx in all area of
0,pleasant,you will be join a xxx motivate team and will be
1,strategic thinking,"prove track record in customer acquisition , xxx xxx and successful campaign delivery"
1,creativity in thinking,development must demonstrate entrepreneurial spirit clearly demonstrate xxx xxx xxx and plan strong write and
1,quick learning,"we be look for a professional , xxx xxx enthusiastic and selfmotivated infrastructure support"
0,prompt,income and instigate action to ensure xxx payment
1,initiative and results driven,ability to work on own xxx xxx xxx xxx excellent communication skill basic salary
0,dynamic,your skill and advance your career within an expand and xxx organisation
0,dynamic,"due to substantial growth they be seek a xxx and accomplish hr manager to support an innovative project ,"
0,courteous,"at all time , provide a friendly , xxx and professional service at all"
0,independent,k our client be one of the top 20 xxx accountancy firm
1,problemsolving attitude,"bullgood communication skill , with a proactive , xxx xxx and ability to work in"
0,independent,want to work with largest xxx company in there field have you get a successful
1,coaching,strategy team sale activity support and xxx own senior level relationship
0,dynamic,com administrator require for a xxx global organisation salesforce
1,work under stress,positive team build attitude ability to xxx xxx xxx and short time line customer
0,dynamic,this be a valuable opportunity to join a xxx software house at the forefront of data management solution
1,accuracy,maintain to a high level of xxx and in a timely fashion
1,interest and desire to learn,a compute or numerate relate subject xxx xxx xxx xxx xxx about finance prop trade
0,dynamic,"a positive and xxx company , their employee engagement level be percent and"
0,dynamic,"the team , implement and maintain a wide range of xxx and interactive website optimise for speed and compatibility add"
1,flexible,"ideal candidate will have a proactive and xxx approach , a keen eye"
0,team working,look for a it service manager to join a busy xxx xxx with the sale director and sale team to develop
0,independent,school information gad s hill school be an xxx day school situate in a semi rural position on the
1,punctual,"the follow quality be essential trustworthy , reliable , xxx accurate , consistent , able to"
1,judgement skills,a good commercial outlook and strong xxx xxx
0,dynamic,they be look to recruit and xxx and enthusiastic sale individual who can promote product range to
0,dynamic,you will be work within a creative and xxx work environment consistently strive to deliver new and excite content
1,solution oriented,occasional facetoface client visit and be highly xxx xxx generate win and close deal
1,enthusiastic students eager to learn,a pleasure to teach in with xxx xxx xxx xxx xxx
1,effectiveness,the campaign requirement personal competency personal xxx and an ability to empathise
1,self directeddirected,"professional develo p ment train , xxx xxx to develop innovative teach and"
1,ability to learn,communication skill and the willingness and xxx xxx xxx
1,results orientation,xxx xxx with strong write and
0,dynamic,"global team , you 'll design and implement enterprise level xxx web application such a medium portal , content management system"
0,independent,"base in central london , this award win small xxx creative agency agency have one more business and be look"
0,dynamic,"to work within a very fast move , drive and xxx financial business base in the centre of bristolas a ba"
0,independent,our client be a major provider of xxx healthcare base in central london
0,dynamic,you will be part of a xxx team who be currently use oracle g
1,customer service ethics,friendly team a personal licence holder strong xxx xxx xxx a strong sense of autonomy
1,passion,"a long a you have the xxx for knowledge , you will"
0,lively,"fantastic career opportunity , good pay and a fun and xxx work environment"
0,dynamic,"teach skill , commit to work alongside a supportive and xxx team to continue to raise standard and achievement across the"
1,ability to adapt,"have strong interpersonal skill , have the xxx xxx xxx to change requirement and"
1,motivation,"attention to detail , accuracy of information self xxx and team work good"
1,ability to travel,rota and attend emergency call out xxx xxx xxx widely within the uk
1,problem solving skills,"executive solid business acumen , management and xxx xxx xxx strong computer skill this vacancy"
0,independent,an xxx boutique hotel locate in cambridgeshire be look for a chef
1,systematic,and skill essential skill have a xxx discipline and analytical approach to
1,friendly and outgoing personality,"xxx xxx xxx xxx with a confident , professional approach"
0,dynamic,"great communication skill ability to work in a small , xxx and performance drive trade culture interest in finance tradingthis be an"
0,team working,"must live and breathe technology , have strong communication and xxx xxx skill"
1,leadership,fresh ingredient a chef who have develop good xxx skill and be capable
0,dynamic,this be a significant opportunity to join a xxx forward think company that will offer long term job security
1,achieving goals,must enjoy the challenge of xxx xxx
1,versatility,"and workflow provide documentation and accountability xxx flexibility , and a willingness"
1,constructive feedback,strong multitasker able to give and receive xxx xxx benefit report analyst
0,consistent,handle and deliver fm service which be xxx with overall business strategy and
1,conceptual thinking skills,tool eg cast or paragon analytical and xxx xxx xxx if you would like to
0,dynamic,"deeside chester permanent dependent on experience my client , a xxx and successful logistics company , be currently look for an"
0,dynamic,this be a unique opportunity for a xxx and experience manager
1,planning skills,"excellent sale , business management and strategic account xxx xxx with a work understand"
0,lively,you will work within a xxx team sell advertise and sponsorship so experience of medium and
1,ability to foster cooperation,xxx xxx xxx xxx and collaboration among team member
1,ambitious,an excite opportunity have arise for an xxx careerdriven salesperson in south
0,team working,degree and a flair for ingenious innovation for this talented xxx xxx at the vanguard of application and software security
0,dynamic,"have multiple position for embed software engineer to join a xxx team responsible for realtime development target future generation audio ,"
0,dynamic,executive due to explansion and be look to recruit experience xxx telesales people who want to progress
1,availability,operational need of the business and xxx of personnel
1,analytical abilities,or programme management and will have excellent xxx xxx
0,dynamic,and establish team secretary to join the team at a xxx finance company base in the west end
0,pleasant,the work environment be a xxx reward and challenge one
1,development skills,grow this desk with excellent business xxx xxx
1,delegation skills,engineer ability to work under pressure strong xxx xxx excellent organisation skill coach and
1,ability to adapt,at height and in all weather condition xxx xxx xxx to new task competently
1,curious,xxx about creative brief
0,team working,"provide their employee with a great work environment , friendly xxx xxx and the opportunity to develop your career to team"
0,independent,"desire a background in the xxx sector would be a bonus , though this be not"
1,decision making abilities,respond quickly excellent interpersonal skill couple with xxx xxx xxx and knowledge of the
1,team working,firstrate xxx xxx and communication skill be
0,detailed,"key purpose of role to undertake the xxx design , analysis , production and"
0,dynamic,our client be a xxx exhibition company and they be look to recruit a top
0,independent,recruit an endoscopynurse to join a large and highly prestigious xxx hospital in london
0,dynamic,primary school and nursery class you will be a xxx selfmotivating individual have a clear underpin vision that involve build
0,independent,"benchmark be a lead sheffield base xxx recruitment consultancy , specialise in sale market , it technical"
0,dynamic,be seek an experience technical support engineer to join their xxx and busy organisation
0,dynamic,in return you will work a part of a xxx team in alondonborough and sub region that be increasingly recognise
1,professional ethics,a keen sense of discretion and xxx xxx
1,assertiveness,a pressurise role appropriate level of xxx desirable requirement experience of
1,problemsolving and responsible attitude,be wellorganised with a logical approach to xxx xxx xxx xxx to follow procedure and record
0,independent,set global standard and policy on xxx price test and reservingexecute finance responsibility in relation to the
1,enthusiastic and determined personality,"drive role a highly motivate , xxx xxx xxx xxx excellent write and oral"
0,independent,"be the opportunity to work within a lead brand of xxx mental health care provider , and to work in a"
0,ethical standards,strong belief in both corporate and personal xxx xxx aim to provide an
1,analytical and logical thinking,"will be dynamic , self motivate with xxx xxx xxx xxx with an ambition to continue"
1,enthusiastic,field be look for someone bright and xxx to play an influential role
0,collaborative,the business pride itself on be a xxx and open environment
0,independent,role in central london the company this be an xxx hospital base in the heart of central london
0,independent,research and be well regard a one of the lead xxx name in the business
1,creative thinking key skills,"culture of engineer excellence , quality and xxx xxx xxx xxx for the technical lead java ,"
0,dynamic,"this be a fast pace , xxx environment"
1,client learning orientation,seek to add value to the xxx xxx xxx a willingness to learn
1,willing to learn,who be keen to succeed and xxx xxx xxx
0,lively,"linea fantastic opportunity to join a fun , friendly , xxx telesales team , base in luxury office at mobberley train"
1,motivating,presentation skill experience in lead and xxx a diverse workforce this
0,independent,"you will join an xxx recruitment consultancy that specialise in pharmaceutical , fmcg , scientific"
1,analytical and critical thinking skills,information gather ability good listen skill strong xxx xxx xxx xxx xxx ability to break down
0,dynamic,"comfortable with computer and database thrive in a busy , xxx work environment adaptable , open to constructive feedback , commit"
1,works collaboratively,on site strategic and annual plan and xxx xxx across a broad range
1,level of self motivation,"flexible and friendly , with a high xxx xxx xxx xxx and initiative and be"
0,dynamic,"organisation , include senior staff and strong , flexible and xxx work relationship be critically important"
1,reliable,"ideal candidate must be empathetic , considerate and xxx and dedicate to the"
0,competitive,"a wellregarded organisation , a well a a xxx salary package dependent on"
0,independent,"the internal audit function of the bank , who provide xxx assurance over the business"
0,dynamic,"since you will be work in a xxx , the ideal java developer will need to have high"
1,flexible with hours,candidate must be prepare to be xxx xxx xxx include potential for night
0,independent,i i recruitment ltd be a lead xxx employment agency provide staff solution across specialist area
1,skills to effectively communicate,"a consistently good outstanding level strong interpersonal xxx xxx xxx xxx with staff , parent and"
0,dynamic,"work , reward job , for one of the most xxx and influential organisation in the world"
1,specificationsense of responsibility,a a member of a multidisciplinary teamjob xxx xxx xxx valid pin numberability to
0,independent,"ote the company mackenzie stuart be work with an xxx sport service company , offer market , event management and"
0,dynamic,"cost management consultancy have a requirement for a hungry , xxx quantity surveyor in milton keynes"
1,self awareness,process and ensure there be senior level xxx xxx of the strength and weakness
0,dynamic,this be an excellent opportunity for a xxx manager who be look to join a prestigious group which
0,independent,"use car , bike , van and caravan primarily into xxx dealer and franchise , deal with store owner and business"
0,independent,demonstrate critical xxx think and the ability to multitask in situation where in
1,autonomy,an impact a well a have the xxx to be creative and carve
0,independent,"to develop their career with an establish , forward think xxx estate agent who be now look to expand on their"
1,sharp,"it take selfconfidence , xxx wit , personality , business development skill"
0,dynamic,require a charles river trade compliance specialist to join their xxx and grow business
1,ingenuity,"you ll draw on your energy , xxx and communication skill to"
1,problemsolving and analytical skills,require this role require strong xxx xxx xxx xxx a well a creativity and
1,flexibility,to meet deadline and prioritise workload xxx this job be originally post
1,language skills,"minimum degree fluent english additional xxx xxx a plus german , slovak ,"
1,work under stress,positive team build attitude 7 ability to xxx xxx xxx and short timeline excellent excel
0,dynamic,"excite opportunity for an experience youth worker to join ignite xxx team , fund by national lottery through the big lottery"
1,willingness to travel,"the english language , both write and speak xxx xxx xxx"
0,independent,"candidate will be passionate about how to help child develop xxx learn skill , be positive , dedicate creative , and"
1,responsable,to be xxx for liaise with other team
1,self starters,for self motivate individual who be xxx xxx can work both autonomously and
1,attentive,you will need to be xxx to detail have a
0,dynamic,"in return we promise a fun , xxx career within one of yorkshire s lead organisation"
1,constructive and proactive feedback,"you will assist your team with structure , xxx xxx xxx xxx of factor that influence"
0,dynamic,", k our client , who one of the most xxx and excite agency in the region be currently look for"
0,dynamic,they offer an excite opportunity to be part of a xxx global organisation and work with experience professional
1,enthusiastic personality,2012 this be essential have an xxx xxx be will to get
1,judgement skills,"problem solve , decision make and have excellent xxx xxx"
1,responsibility,head of creative solution your overall xxx will be to manage and
1,to write,understand how xxx xxx online content to drive
1,strategic thinking,you will need to demonstrate your xxx xxx medium handle ability and breadth
1,willingness and ability to listen,achieve excellent earn and career progression a xxx xxx xxx xxx xxx and learn quickly a
0,dynamic,your ability within a new career in an excite and xxx role
1,lively personality,"character and have a bubbly , keen and xxx xxx"
0,independent,1 market leader establish over 20 year world 's largest xxx provider of distance learn excellent train opportunity the role
0,dynamic,support project planner south somerset know project planner require for xxx software house base in south west somerset
0,dynamic,it desktop support engineer require for my xxx and professional client base in the heart of brighton city
1,tactful,at the role you will be xxx diplomatic and always look
1,ability to communicate,xxx xxx xxx clearly in person and
1,organized,at director level drive and tenacity well xxx work towards target ability to
0,dynamic,this firm be able to offer a xxx work environment a well a a structure career path
1,judgment and decisionmaking skills,excellent xxx xxx xxx xxx
0,team working,excellence in xxx xxx include across virtual and multilocation team
1,organisational skills,demonstrate good communication and xxx xxx
1,driven,have arise for an experience and xxx ppc professional to join
0,dynamic,that have high expectation for their student and provide a xxx and stimulate environment in which they can learn and develop
0,team in providing management,"will be to assist the current plan xxx xxx xxx xxx information to establish process ,"
1,analytical,"mathematical , compute or financial degree an xxx background , ideally from within"
1,correct reporting,of monthly accrual and adjustment to provide xxx xxx to p l account
1,responsible delivering person,"within the service you will be xxx xxx xxx centre care , ass and compile"
1,public speaking,customer acquisition strategy improve and develop xxx xxx skill requirement for successful
1,to write,expert level knowledge of microstrategy ability xxx xxx wellstructured tsql extensive knowledge of
1,quick learning,the ideal candidate will need to show xxx xxx attribute to understand exist
0,inspired,be an ideal place to be xxx
1,teamworker,excellent attention to detail highly motivate enthusiastic xxx but able to work
0,lively,personable and outgo a you will be work in a xxx team
0,dynamic,"can offer an attractive remuneration package , a fun and xxx environment to work in , a health benefit scheme ,"
1,manage multiple tasks,highly motivate with the ability to xxx xxx xxx and work well under pressure
1,training key skills,from the service desk general it support xxx xxx xxx require experience within a
1,dynamic personality,"relate field , and have a drive and xxx xxx"
0,lively,"provide you with a great salary and earn potential , xxx work environment , incentive , pension plan , life cover"
0,dedicated,to be a key member of a xxx small multidisciplinary team which will
1,self confidence and initiative,"clinical team tenacity , enthusiasm and drive , display xxx xxx xxx xxx laptop private medical insurance"
1,ability to organize,deliverable ability to interface and influence xxx xxx xxx and plan own task
1,creativity,bull bring your own xxx enthusiasm and real world problemsolving
0,dynamic,health the client our client be a successful and xxx fit out specialist who operate in a variety of sector
1,self directed learning,support will be give in addition to xxx xxx xxx
0,independent,"prestigious opportunity with a pioneer xxx management consultancy , dedicate to provide specialist expertise within the"
1,understanding,professional person excellent management skill and financial xxx welcome personality reward salary
1,service oriented mentality,"of key importance though , be a strong xxx xxx xxx a high sense of"
1,business programme leader,people management the close date for the xxx xxx xxx vacancy be 21 january
1,self directive learning,evidence of prep portfolio or xxx xxx xxx ability to recognise limitation
0,independent,"berketex bride be the largest xxx bridalwear retailer with over store throughout the uk ,"
0,independent,new business conversion sale record of consumer product into to xxx retail our client be a market lead consumer brand that
0,easy going,my husband and i be friendly and xxx xxx
1,flexible with working hours,"or within an engineer environment , must be xxx xxx xxx xxx day and night available"
0,dynamic,this be a xxx and innovative area of our business with strong growth prospect
1,team work,their own initiative and have a good xxx xxx ethic at all time
0,dynamic,a hand on technical nbspconsultant to work for a xxx and expand consultancy
1,team builder,xxx xxx and motivator understand of
1,skills ability to communicate,good interpersonal xxx xxx xxx xxx effectively both verbally and
1,meeting weekly payment deadlines,xxx xxx xxx xxx work on own initiative confident
1,timemanagement and communication skills,"analytical and problem solve skill excellent organisational , xxx xxx xxx xxx please apply now and"
1,communicating skills,"of risk management principle it literate , effective xxx xxx verbal and write"
1,initiative,prioritise workload and work on own xxx excellent interpersonal and communication
1,friendly personality,to apply you 'll need an outgo and xxx xxx excellent communication and customer
0,independent,consider you must have previous experience of provide tie or xxx regulate advice 12 month
1,organisational and prioritisation skills,this role require good xxx xxx xxx xxx include good sale technique
1,memory management skills,"developer objective c xcode cocoatouch ipad core data mobile with xxx xxx xxx specifically with mrr , be"
0,dynamic,"for a motivate candidate that be keen to join a xxx team , fastpaced team within their analytics function base in"
1,listening and communication skills,excellent xxx xxx xxx xxx
1,ability to sell,you will have the xxx xxx xxx to business end user in
