is_soft_skill,soft_skill,context
0,independent,"acceptance and unit test candidate should be able to demonstrate xxx think , problem solve and innovation that have add value"
0,independent,career progression about company client my client be an xxx provider with an excellent local reputation
1,meeting pre agreed deadlines,be complete all task correctly and xxx xxx xxx xxx resolution of finance relate
0,independent,opportunity to grow sale and increase profitability of corporate and xxx customer contract responsible for the business 's balance sheet
1,critical thinking skills,from international u highly analytical together with xxx xxx xxx multitasking skill highly adaptable flexible
1,communication skill,and statistical technique good verbal and write xxx xxx good presentation skill managerial
1,managerial skills ability,from within the hotel service apartment industry strong xxx xxx xxx to react quickly to guest
1,reliable,"a team excellent telephone manner professional , xxx and flexible attitude strong write"
0,driven driven,"to support internal business or external market xxx initiative , restructure of exist client business and reengineering initiative xxx by industry change"
1,commitment to teamwork,undertake and or evaluate empirical research project xxx xxx xxx excellent research and write
0,independent,career further with one of the uk s award win xxx recruitment consultancy
1,analysis skills,a disperse network strong management account and xxx xxx preferably demonstrate in a business
0,dynamic,this be an excellent opportunity to join a new and xxx research group and explore an excite frontier of the periodic
0,dynamic,this be an excite opportunity to join a xxx finance team
1,logical,"skill require xxx and physical data model ,"
1,communicative,you will be a xxx individual able to identify strength
0,independent,support be one of the uk s lead and largest xxx recruitment consultancy
0,dynamic,"brand and be look for a new challenge within a xxx and intellectually stimulate environment , this could be it"
1,selflearner,aggressive xxx of new market system
1,problem solving,flair for lateral think and proactive xxx xxx desirable skill and experience
1,commitment to our community accountability,xxx xxx xxx xxx xxx and ownership take responsibility
1,dynamic and proactive person,this role require a xxx xxx xxx xxx who be able to work
1,trouble shooting,"identify opportunity for continual improvement or xxx xxx ie waste , downtime , carry"
0,followthrough,source coordinator manage the seasonal placement and xxx of finish good for particular
1,passion,"drive and motivation , along with a genuine xxx for both consumer and"
0,independent,undertake initial visit to foster carer applicant to liaise with xxx social worker with regard to the completion of form f
0,independent,"my client , a flourish , xxx agency , set in a gorgeous london location , have"
0,independent,"luton and the surround area to help our client remain xxx in their own home , provide various aspect of care"
1,skills to effectively communicate,"of achievement and behaviour , with strong interpersonal xxx xxx xxx xxx with staff , parent and student ,"
1,client oriented,environment and comfortable with cold call xxx xxx and proactive sale approach
1,work ethic,growth opportunity maintain a strong culture and xxx xxx within the team fully
0,dynamic,develop your career and gain experience in a lively and xxx environment and also to use your experience to date and
1,peopleempathy,highly ethical and client focus excellent xxx persuasive skill
0,independent,"we work together a a team of xxx individual , follow a prove business and market system"
1,sound business judgment,discretion in business relationship and exercise xxx xxx xxx for more information about
0,independent,duty manager require for new xxx live estate in cheadle new commission a fantastic opportunity have
0,passion,"be , and continue to be , it xxx for food"
0,dynamic,"involve in a startup , bureaucracyfree environment in a lead xxx sector of the software industry"
0,independent,londonto first class benefit my client be a super xxx pr communication agency reward for their excite and imaginative campaign
1,tolerant,experience in the development of fault xxx critical system with efficient
0,disciplined,"develop software use xxx software development process , adhere to"
0,schedule,conduct or xxx the auditor to perform
1,analysis and problemsolving skills,computer science or mathematics very strong xxx xxx xxx xxx ability to work independently
0,dynamic,"able to create advance sql store procedure include use xxx sql , dts package , sql job , view"
1,smart,xxx and credible you will be
0,dynamic,this xxx and progressive firm have always show desire to develop their
1,verbaltelephone communication skills,good level of english language good xxx xxx xxx previous office experience friendly nature
0,dynamic,excellent opportunity for an ambitious infrastructure specialist to join a xxx and grow it environment at one of the market lead
0,team working,upto k pump service engineer require to join the xxx xxx within a company that provide integrate engineer solution
1,patient,responsible for ensure high standard of xxx care manage and motivate the
1,multitasking skills,"flexible , a team player , and posse good xxx xxx"
1,communicating skills,relationship management and strong influence and xxx xxx both verbal and write a
1,sociable personality,a be a lively and xxx xxx a this will be essential
0,organizational,the business to identify opportunity for xxx change and take ownership
0,dynamic,prefer supplier to many of the uk s most xxx organisation and we always have vacancy at any level include
1,conceptualization,to the brief and art direction from xxx through final implementation of any
0,independent,a sale negotiate in notting hill w require by an xxx estate agency in notting hill w area to join an
1,professional attitude,well present with a xxx xxx
1,achieving challenging goals,self starter drive and focus on xxx xxx xxx confident about work in a
1,communication skill,strong stakeholder management skill and also xxx xxx drive energy and enthusiasm
1,tolerant,best technologist and designer of fault xxx high performance java code
1,self confidence,"show tenacity , enthusiasm and drive , display xxx xxx and initiative develop relationship"
0,independent,opportunity to grow sale and increase profitability of corporate and xxx customer contract
1,leadership,"experience , use lean manufacture methodology exceptional xxx capability and prove experience of"
0,dynamic,super career opportunity for an experience administrator to join a xxx company with a fantastic work environment
0,lively,80 audit and sit within the very friendly and xxx forensics team
1,motivation,"employee and line manager through effective xxx leadership , coach and train"
1,organizational,strategy and plan in alignment with xxx objective
1,abstract thinking,and strategic approach a well a xxx xxx o high level of
0,lively,"it s xxx work , with regular event , a vary menu ,"
1,willingness to listen,objective high level of personal discipline a xxx xxx xxx and learn with an
0,dynamic,producer be a fantastic opportunity to join a young and xxx creative event production agency
0,independent,need with the aim to support people to become a xxx a possible
1,open to change,a team and be flexible xxx xxx xxx ability to prioritize work
0,lively,ability to manage the office most importantly a friendly and xxx character
1,relationship builder,product be essentialyou will be a good xxx xxx with a strong personality and
1,hardworking,"you will need to be flexible , xxx and reliable , and able to"
0,warm,guest in a way that promote a xxx and friendly atmosphere within the
0,dynamic,"assembly process , be customer focus and also posse a xxx and proactive approach the main responsibility for the role be"
0,independent,our exist client baseour client be the lead source of xxx advice and insight on digital market and ecommerce
1,self motivatedself,a to supplement your sale pipeline xxx xxx starter excellent presentation skill great
0,independent,"assist live manager require for new xxx live estate in ongar , essex"
0,aggressive,they have xxx growth plan over the next 5 year and want to
0,dynamic,in return you will work a part of a xxx team in a london borough and sub region that be
0,team oriented,the opportunity to work in a friendly xxx xxx environment
1,willing to travel,be xxx xxx xxx to client sit if when require
1,team work and communication skills,accountant with strong time management and excellent xxx xxx xxx xxx xxx
0,dynamic,be you look for a role work in a xxx and forward think catholic primary school this early year
0,independent,"teacher within the forest of dean classpeople , a lead xxx education consultancy , be look to recruit an experience qualify"
0,independent,"benchmark be a lead sheffield base xxx recruitment consultancy , specialise in sale market , it"
1,work ethic,have recruitment experience profesionalism and a strong xxx xxx determine be self motivate
0,building,the audit and management committee and xxx relationship with key stakeholder
1,initiative,xxx to resolve nonstandard customer problem
1,ability to manage,focus with good communication skill and the xxx xxx xxx the team effectively
0,independent,a a restaurant manager or assistant restaurant manager from an xxx high street restaurant to aa rosette level
0,independent,be seek to help build a pioneer distribution platform for xxx game developer
0,team working,have an open for a field engineer to join a xxx xxx on market lead information system
1,negotiation and diplomacy skills,evidence of high quality communication skill include xxx xxx xxx xxx
0,dynamic,who be look to work in a fast pace and xxx environment
0,lively,a wonderful chance to join a supportive team within a xxx school until the end of the academic year
0,dynamic,endoscopy nurse to join one of the uk 's most xxx and energetic provider of private healthcare
1,diplomatic manner,"calmly and professionally , in a sensitive and xxx xxx to deliver positive outcome"
0,independent,provide support and encouragement to enable customer to lead an xxx lifestyle within their own home
1,able to influence and persuade able to influence and persuade,frank feedback to colleague and be xxx xxx xxx xxx xxx at a senior management level and also be xxx xxx xxx xxx xxx up to board level
1,detailed,"for support purpose , include maintain a xxx bbw network and configuration"
0,dynamic,"real opportunity to get involve with a fast pace , xxx company"
1,organising skills,"target drive plan , time management and xxx xxx numeracy meet sale target"
1,energy,be look for be a follow xxx and enthusiasm someone who
0,independent,our client base span from small xxx law cost firm to top 10 international law firm and have
0,independent,"work in partnership with the uk 's lead xxx boutique , our client bring the consumer the most up"
1,goal oriented,project plan software strong communicator write verbal telephone selfmotivated xxx xxx keywords personal characteristic maintain
0,dynamic,"you will become part of an energetic and xxx branch , determine to further develop and grow your division"
0,independent,"lot of opportunity job purpose to provide an xxx mortgage payment protection , life cover , insurance pension advisory"
1,teamworker,flair for work with advance equipment xxx and ability to plan
0,dynamic,"debt line offer a fast move , xxx and challenge environment to work in"
0,team leader,hour per week the call centre xxx xxx be accountable to the property
1,goaloriented,inside sale environment highly motivate and xxx enjoy or have a
0,dynamic,horsham district be a xxx area subject to considerable pressure for growth and change
0,independent,"operationally efficient terminal in the world , grain be an xxx unregulated business with an annual turnover of circa m"
0,dynamic,a good salary and the support of a friendly and xxx team
1,organized,"and succeed bullcustomer image ndash calm , xxx and professional , will go the"
1,critical thinking,anticipate and exercise xxx xxx and to effectively influence
1,proactive,skill good team player with a cando xxx approach ability to use
0,dynamic,there be two permanent vacancy for xxx sale executive look to join a quickly expand company
1,building,the relationship xxx skill to liaise effectively with
0,dynamic,would like the opportunity to work for a progressive and xxx dealer group please click 'apply now ' below to submit
0,dynamic,work part of a small xxx finance team you will be report into the finance manager
0,opportunityaffirmative,be proud to be an equal employment xxx action employer provide a
0,independent,for you interaction recruitment be the uk s fastest grow xxx recruiter with office across the country
0,dynamic,no cold call we require ambitious and genuinely xxx sale people
1,results driven,develop and inspire the team be xxx xxx with strong financial understand
0,innovation,the future of healthcare through discovery and xxx
1,self directed,work under pressure adaptable flexible xxx xxx positive attitude this vacancy
0,dynamic,"a fast move , xxx and progressive company to work for"
0,dynamic,a such we be seek c developer to join their xxx
1,smart,be persuasive and persistent be of xxx appearance be flexible and adaptable
0,independent,"be to develop cognos framework model for use in an xxx environment and report platform , maintain the end to end"
1,influencing and negotiating skills,"strong time management and organisational skill xxx xxx xxx xxx desirable criterion retail , merchandise and"
0,dynamic,radiographer to lead a dedicate team within a busy and xxx hospital
1,judgment,"the ideal candidate must have excellent xxx problemsolving , oral , write and interpersonal"
1,make decisions,and the ability to prioritise ability to xxx xxx and solve problem in
0,dynamic,have passion for what they do experience of manage a xxx and charismatic team vacancy multisite retail manager location
1,confident and dynamic personality,"target drive and negotiation skill proactive , xxx xxx xxx xxx excellent communication skill salary k"
1,sympathy,"drive and enthusiasm , an understand and xxx with the ethos of a"
1,oral skills,you must have excellent write and xxx xxx an excellent communicator and the
1,communication skill,"confident and proactive with good xxx xxx both verbal and write ,"
1,facilitating meeting skills,"strong negotiation , presentation and xxx xxx xxx"
0,independent,increase accessory sale within a dealership excellent communication skill selfstarting xxx consultancy skill set english fluent whilst educational level be not
0,dynamic,work on multiple project in a xxx and challenge environment
1,customer orientation skills,excellent interpersonal and xxx xxx xxx demonstrate in a customer focus
0,dynamic,", with experience of work in a forward think xxx organisation and it be essential that you have the ability"
0,independent,22 day holiday company well establish and highly profitable xxx business with a national network of office
0,aggressive,what you ll be do we have xxx growth plan for 2012 and with this in mind we
1,self starters,a career within digital market must be xxx xxx and very achievement focus how
0,dynamic,include continuous support for your practice through our new and xxx learn and development team
0,independent,we be an xxx recruitment consultancy specialise in recruitment solution worldwide
1,responsible delivering person,"within the service you will be xxx xxx xxx centre care , ass and compile"
1,communicative,to apply have strong behavioural and xxx skill must be flexible
0,independent,"plus benefit historic royal palace hrp be the xxx charity that have responsibility for the tower of london ,"
1,people management skills,it will require strong xxx xxx xxx in a dynamic sale
1,decision making skills,be a must along with strong xxx xxx xxx and excellent commercial awareness
0,independent,my client be an xxx engineer consultancy base in swansea who be currently look to
0,dynamic,this be an excite opportunity to help develop a xxx business through the recruitment and train of their staff
1,marketing and dissemination skills,"measurable outcome and impact , excellent project management , xxx xxx xxx xxx a well a experience of"
1,problemsolving,be a team player with excellent xxx and troubleshoot skill must
1,calm,additionally candidate should be able to keep xxx constructive and discipline when under
0,independent,about red star associate red star associate be an xxx organisation specialise in hospitality recruitment
1,action oriented,ethic strong and prove negotiation skill xxx xxx strong personal motivation and drive
0,independent,s pharmacy division be recruit for an excellent wellestablished xxx pharmacy locate in the brighton area
0,independent,"sou chef who would you prefer to work for an xxx business with an excellent local reputation , but want to"
0,independent,"you will provide an xxx view of the effectiveness of the group s governance ,"
1,problem solving and analytical abilities,prove success work in teamorientated environment prove xxx xxx xxx xxx xxx desire to work in an
1,results orientation,manager competence area customer orientation adaptability xxx xxx plan organisation management control teamwork
0,dynamic,agile our client be look for a highly enthusiastic and xxx qa manager to work across functional team on multiple project
1,ability and willingness to travel,xxx xxx xxx xxx xxx when ever require
0,dynamic,"the successful candidate , a prove handson and xxx leader , will be responsible for ensure the factory be"
1,organized,this position need to be a strong xxx people manager with at
1,team who genuinely work,to join a motivate and supportive xxx xxx xxx xxx together to get the
1,imagination,"entrepreneur , market guru and dreamweaver , use your xxx to set the scene for"
1,detailed,system kpi 's client face xxx report opportunity to learn
1,solvingquick learning,and interpersonal skill aptitude for problem xxx xxx positive attitude and high level
1,diplomatic and positive manner,"able to influence people in a calm , xxx xxx xxx xxx proactive , forward think approach"
0,independent,v recruitment be currently work in partnership with a wellestablished xxx and hugely successful business base in london
1,innovative and forward thinking,prove project management skill and be xxx xxx xxx xxx with good problem solve
1,enthusiastic,to nqt 's newly qualify teacher an xxx wellmotivated and talented classroom practitioner
1,people management skills,"person , with the follow skill set strong xxx xxx xxx include prove performance management prove"
1,telephone communication skills,a crm system such a sap impeccable xxx xxx xxx call mpeople now interview be
0,dynamic,"a a member of a focus and xxx team , you will explore and exploit new technology ,"
1,problemsolving attitude,"and script an energetic , enthusiastic , proactive , xxx xxx the ability to work in"
0,forward thinking,experience system tester to join a xxx xxx company where talent be
0,dynamic,"and be look for a opportunity within a progressive and xxx environment , please forward your cv today"
1,influencing skills,"be seek , a be excellent communication and xxx xxx plus the ability to"
1,teamwork skills,initiative ability to work to deadline good xxx xxx good communication skill and
1,negotiator,you must be an excellent xxx and be experience in
0,dynamic,"and javascript , and will work a part of a xxx team build , design and maintain website system within the"
1,team building,attitude good prioritisation time management skill xxx xxx and management skill
1,accuracy in all work,trouble shoot excellent attention to detail and xxx xxx xxx xxx ability to conduct productive research
1,supervisory skills,"of bm system , control system and xxx xxx would be an advantage"
0,dynamic,"equity share you will become part of an energetic and xxx company , determine to further develop and grow your division"
0,independent,way in provide hardware and software base solution to the xxx retail sector
1,results driven,a xxx xxx structure work style be essential
0,team working,"they require an sap basis consultant to join a new xxx xxx for a significant , global client , base in"
1,diplomacy skills,adm voip highly develop communication and xxx xxx with a strong ability to
1,desire to succeed and learn,sector excellent verbal and write skill the xxx xxx xxx xxx xxx quickly in a new
1,committed,"to work within a prestigious private hospital , xxx to provide high standard of"
1,work well in a team,a confident communicator with the ability to xxx xxx xxx xxx xxx
1,staff management,xxx xxx be involve with the
1,advocacy skills,wale and cost case law demonstrate strong xxx xxx strong negotiation skill high level
0,dynamic,flexible self starter who will enjoy work within a small xxx team outgo individual who be comfortable talk on a technical
0,dynamic,you will enjoy a fast move xxx environment and will have a track record of successfully deliver
1,able to persuade,"to their cv strong influence skill , xxx xxx xxx negotiate and influence both internal"
1,attention to detail,of pivot table good interpersonal skill xxx xxx xxx ability to work a
0,dynamic,be look for enthusiastic medium sale executive to join their xxx team
0,dynamic,"manage a customer service team within a fast pace , xxx environment"
0,team worker,"support , facilitate and promote development of each xxx xxx with share decision make and"
1,sharp,and you will need to be commercially xxx and be able to
0,independent,"store manager who would you prefer to work for an xxx business with an excellent local reputation , but want to"
1,customer service orientation,friendly and user friendly language exceptional xxx xxx xxx and experience in work in
1,proposal writing skills,of aircraft interfacing and associate standard protocol technical xxx xxx xxx thorough appreciation of safety and
0,team working,look for an mdta to join our community outreach xxx xxx in our new outreach centre in trowbridge and peasedown
1,prioritization skills,to juggle multiple task project simultaneously strong xxx xxx ability to meet deadline
0,dynamic,oxfordshire an excite opportunity have become available for a xxx professional to join one of europe s largest multidisciplinary
0,dynamic,"you a high degree of autonomy within an excite , xxx industry please send your cv without delay"
1,problem solving,"role will require firstclass organisational skill , good xxx xxx ability and a servicedriven approach while"
0,team member,office or their software escalate to relevant xxx xxx if unable to assist
1,team leader,you will be report to the collection xxx xxx on a daily basis
0,team working,", aspnet and sql server will join the development xxx xxx on a major project for the business"
1,creative and innovative approach,in fast pace market environment project management xxx xxx xxx xxx confident energetic approach excellent
1,loyalty,"support to customer , drive both customer xxx and profitability"
0,independent,", support people in primary care trust to live xxx live in the community , outside care home or hospital"
0,independent,"focus on client care benchmark be a lead sheffield base xxx recruitment consultancy , specialise in sale market , it"
1,practical,xxx sage 50 knowledge be essential
1,accurate,"key responsibility grow , monitor and maintain an xxx sale pipeline include regular audit"
1,positive attitude,"skill write and verbal , interpersonal skill , a xxx xxx and the ability to thrive"
1,ability to anticipate,business implication of financial data prove xxx xxx xxx business performance issue opportunity and
0,dynamic,the role be very xxx and diverse with a large proportion of diary and travel
0,lively,"the team full of xxx character , and passionate sale people they only employ the"
0,dynamic,specialist oxford basic plus excellent bonus ote this xxx tour operator specialise in tailormade holiday and small group tour
0,dynamic,"be an excite opportunity to gain experience work within a xxx global company , in a constantly evolve environment where dedication"
1,friendly professional personality,"about your job , you must have a xxx xxx xxx a you will be ask"
1,managerial and motivational skills,of staff and suitably demonstrate excellent xxx xxx xxx xxx
0,dynamic,focus and capable of sustain a fast pace in a xxx environment be able to work with little or no
0,dynamic,you will be work with a very hardworking and xxx team offer a wide portfolio of product and service to
0,dynamic,in the follow manage a purchase team within a xxx high volume production environment
0,innovation,"total cost , security of supply and xxx be secure"
0,team working,your xxx xxx and leadership skill will be a powerful combination
0,independent,"first point of contact for the business , deal with xxx boutique and buyer from lead department store"
1,mentoring skills,call centre environment advance coach and xxx xxx motivate people encourage your staff
0,dynamic,"adhoc task and drive them forward understand the complex and xxx relationship between group finance , rwas , capital plan"
1,logical,designer developer with solid design skill and a xxx mind to join their
1,facilitation and negotiation skills,"outstanding leadership skill excellent communication skill xxx xxx xxx xxx ability to moderate , build consensus"
1,self disciplined safety awareness,of an erp system good interpersonal skill xxx xxx xxx xxx time management work under
0,dynamic,personal and professional skill to develop their career in a xxx market
1,creative approach,have a xxx xxx to teach
0,independent,here at elite we be an xxx recruitment agency for health and social care staff
1,honesty,"and career development you must show loyalty , xxx and desire to succeed articulate ,"
