is_soft_skill,soft_skill,context
0,independent,our client be a lead xxx provider of care to elderly service user across the uk
1,hardworking,dynamic approach to vary task a xxx and conscientious attitude the successful
1,team work,test transformer test competency require for position xxx xxx communication strong safety ethic initiative
1,manages time effectively,the intend audience plan and organise xxx xxx xxx monitor performance against deadline and
0,dynamic,4 day plus super benefit my client be a xxx and highly creative pr agency work with blue chip company
1,polite,"service skill , be smartly present with a xxx telephone manner"
0,to write,easy stepbystep process will allow you xxx xxx your will at your own
1,eager to learn,to progress in their career and xxx xxx xxx
1,selfconfident,"successful candidate will need to be xxx with good influence skill , a"
1,quick learner,concept to nontax professional and a xxx xxx who can cope with
0,independent,"these event which would enable me to live a more xxx and inclusive life main responsibility calm , patient , reliable"
1,analytical thinking skills,php and sql strong logical and xxx xxx xxx good problem solve skill
1,self managing confident,proactive fast thinker self motivate and xxx xxx xxx and appropriately assertive positive
0,independent,experience recruiter to progress their career with a quality regional xxx in their prime location norwich city centre office they currently
1,diplomatic,"creative and collaborative discreet , tactful and xxx ability to work proactively"
1,lively and sociable personality,a be a xxx xxx xxx xxx a this will be
1,able to prioritize,organise and be xxx xxx xxx work with accuracy and
1,skills in motivation and training,general management xxx xxx xxx xxx xxx
0,manner,"covenant package in a concise , user friendly xxx"
0,dynamic,glasgow city council be seek to recruit highly motivate and xxx staff
1,presentation,"network , relationship and interpersonal skill great xxx skill with the ability to"
1,sense of responsibility,business relationship passionate about the product strong xxx xxx xxx accountability selfmotivated adaptable initiative tenacity
1,articulate,"applicant will be presentable , xxx numerate and experience at understand"
0,team that work,lively and well motivate project management xxx xxx xxx on high profile project
1,personal attributes excellent management and leadership skills,candidate requirement key skill and xxx xxx xxx xxx xxx xxx xxx
1,systematic,"use own initiative , be well organise and xxx strong attention to detail"
0,aggressive,itself on it consultative sale approach a oppose to an xxx sell
0,independent,we be the largest xxx supplier of education resource in the uk
1,mature independent personality,with a creative and cost conscious approach xxx xxx xxx self organize and priority focus
1,coordination skills,environment a well a time management and xxx xxx you will have excellent write
0,dynamic,look for a high calibre java developer to join a xxx development team
0,independent,a friendly and confident manner be seek by this lead xxx business travel company
0,aggressive,"strapline be understand energy save money ba have some very xxx plan for growth and be actively recruit selfmotivated , determine"
0,professionalism,"so we offer the advice , support and xxx garner from many year experience"
1,development skills,your substantial client expertise and people xxx xxx a well a your strategic
1,self motivation,hand on approach self confidence and xxx xxx in order to ensure
0,counseling,xxx need for specialise medical
1,able to persuade,consistently be xxx xxx xxx the customer into a 'positive'
0,team working,", you will be act a a member of a xxx xxx on a highprofile education project for a large public"
0,dynamic,for xxx web application
0,respect for our colleagues,be treat equally and have the highest xxx xxx xxx xxx whose primary aim be to
1,management skills,competency prove leadership skill excellent project xxx xxx strong attention to detail
0,independent,the successful candidate will be responsible for the timely xxx delivery of technical solution to meet define commercial objective within
1,project management,"senior level and posse exceptional communication , xxx xxx and people management skill"
0,people oriented,one of the most innovative xxx xxx optician business in the
1,team player,effective xxx xxx flexibility in line with work
1,selflearning,with the ultimate aim to establish a xxx organisation offthejob class room train
0,dynamic,"skill if you would like to be part of this xxx company , send in your cv now"
1,conceptualization skills,strong xxx xxx and ability to articulate
0,outgoing,main duty handle all incoming and xxx telephone call in a
0,dynamic,communication skill and experience of work in self organise xxx team desirable recent experience of use selenium webdriver api to
1,personal standards and integrity,must posse the highest xxx xxx xxx xxx
0,dynamic,arise for a test analyst to join an agile and xxx team base in bristol
1,ability to motivate,and innovative history teacher with the xxx xxx xxx student
1,ability to travel,both in the uk and overseas so xxx xxx xxx be essential
0,independent,lead xxx market agency be look for a superstar account manager
0,dynamic,"partie creativity , a passion for food , a xxx approach if these thing describe you we would love to"
1,quality minded,welcome application from those who be xxx xxx and approach any job
1,easy going,look for quickly develop relationship with client xxx xxx and personable with client
1,accurate,m office skill along with fast xxx type wpm and ideally
0,team working,role will be work within the high volume client data xxx xxx with real time data update
1,disciplined,good wine knowledge effective communicator selfmotivated and xxx legal right to work
0,independent,the company s extensive range of internet market solution into xxx sme s
0,lively,will be a confident communicator and enjoy work in a xxx work environment
1,work ethic,"a cando attitude , a pragmatic problemsolving xxx xxx who be prepare to"
0,dynamic,the specialist analytic tool and technique use to meet the xxx challenge that gchq face
1,learn quickly,decision to specialise in software test ability to xxx xxx and knowledge of microsoft
1,scheduling skills,"and multiskilled good communication , plan and xxx xxx"
1,responsible person,monthly cash flow report for the xxx xxx and to ensure that adequate
1,communication skills,candidate will have excellent customer focus and xxx xxx and high attention to detail
0,aggressive,"the isr drive result through outstanding teamwork , xxx prospect , hightouch sell process , and exceptional customer relationship"
0,counseling,"annual leave occupational sickness benefit scheme hour xxx service , with the opportunity to"
1,openminded,team you will be flexible and xxx and enjoy the challenge
0,dynamic,"this be an excite opportunity to join a progressive and xxx company with excellent salary , allowance and benefit package"
0,independent,"broker dealer a marketleading , xxx financial service company have a new requirement for an experience"
1,creative thinking,"a team around you , inspire , encourage xxx xxx and support them to overachieve"
1,motivation,documentation quality assurance consultant coordination management xxx of team review of resource
0,dynamic,we need a xxx person centre individual who will promote lifestyle choice nbsp
0,dynamic,"this be an amaze opportunity to join an excite and xxx company , work with some of the lead light of"
1,organizational capabilities,by management requirement excellent multitasking and xxx xxx project management experience ability to
0,dynamic,be seek an outstanding senior finance manager to join it xxx it team
1,hospitable,our vision our dream be of a xxx society where individual need
1,selfdevelopmentselflearning,achievement to show evidence of xxx to display a
1,enthusiastic,excellent communication skill both verbal and write xxx with the ability to motivate
0,dynamic,"the successful candidate must also be inspirational , engage and xxx with the ability to deliver lesson that be good to"
0,dynamic,senior construction planner an opportunity have arise for a xxx senior planner to join this lead multi discipline engineer consultancy
0,dynamic,"be a great opportunity to join a fast grow , xxx yet relax company in central london that will allow you"
1,cheerful personality,good it skill and a bright and xxx xxx
0,team working,this be an innovative xxx xxx environment with plenty of admin support and flexible work
0,friendly,team must also invest into this xxx environment
0,independent,build student accommodation crm be the uk s lead xxx manager of student accommodation with multiple sit throughout the uk
0,independent,they be the lead xxx supplier of bakery ingredient and enjoy a sale turnover in
1,attentive,problem quickly and efficiently diligent and xxx to detail follow through on
0,team working,"first class communication skill both write and verbal , great xxx xxx skill , well organise , show initiative , logical"
1,self confidence,the ability to use microsoft office tool xxx xxx demonstrate a positive attitude at
0,independent,"upminister and the surround area to help our client remain xxx in their own home , provide various aspect of care"
0,dynamic,"eat and purchase our product , we be seek a xxx and entrepreneurial senior innovation manager to lead , develop and"
0,dynamic,"sale more important be your enthusiasm , tenacity and xxx approach"
1,assertive,who have the ability to be xxx
0,result orientation,record of create high performance team xxx xxx involve preparation service for
1,take the initiative,happy to xxx xxx xxx
0,team working,"net developer , bracknell fantastic opportunity for to join aprogramming xxx xxx on database centric application for newspaper , directory ,"
1,personal time management skills,or escalate a necessary excellent deadline and xxx xxx xxx xxx ability to rollout solution that
0,dynamic,or aca acca studier and be look to work in a xxx environment where your ability and talent will be recognise
0,independent,"cocktail knowledge your background will be either in a quality xxx pub din concept , fine din restaurant or a similar quality"
0,dynamic,our client within financial service be a xxx business with a fresh approach to manage the requirement of
0,team working,"you will also have good interpersonal , xxx xxx and organisational skill , hold an svq level 2"
1,diplomatic,workplace excellent interpersonal and communication skill xxx and negotiation skill the
0,team working,you will be part of a xxx xxx to resolve problem situation
0,independent,necessary to reinvigorate the library a a relevant centre for xxx learn within the school community
1,willingness to travel,full drive license and xxx xxx xxx if require highly desirable degree
1,communicative,personal skill xxx and social must be
1,analytical thinking skills,"decision make judgement , negotiation , problem solve xxx xxx xxx"
1,professional manner,of customer service with a confident and xxx xxx proficiency in microsoft application
1,ambitious,with benefit free park an xxx business development executive with
0,dynamic,look to develop your career within a team focus and xxx environment
1,communicate easily,to join our team who can xxx xxx with colleague at all
0,independent,nurse service be one of the uk s lead xxx nurse agency supply all aspect of the uk health care
1,hard worker,"be a genuine , creative , ambitious and passionate xxx xxx who be both a team"
1,leadership and management skills,quality assurance knowledge of quality system excellent xxx xxx xxx xxx excellent network and communication
0,dynamic,take advantage of excellent earn potential in an excite and xxx environment with excite growth plan over the next 12 month
0,dynamic,be look for a proactive team player to join their xxx market team
0,independent,"self motivate benchmark be a lead sheffield base xxx recruitment consultancy , specialise in sale market , it"
0,dynamic,"have come from a very commercial , fast pace and xxx organisation"
1,coordinating any testing skills,liaison with oracle on demand responsible for xxx xxx xxx xxx oracle ebusiness suite eb
1,autonomy,the group so you will enjoy significant xxx to drive the business
1,forward thinking,"confident , proactive and efficient individual with xxx xxx fresh idea to bring to"
0,team working,right candidate to become an integral part of the it xxx xxx on a core element of the it solution
1,management skills,"skill , be highly organise with excellent time xxx xxx"
0,dynamic,you will be part of a xxx and forward think team and will have the opportunity to
1,multitask detail oriented,"great interpersonal skill and ability to xxx xxx xxx ambition , strong work ethic and"
1,organising skills,"project management , plan and xxx xxx base on recognise management"
1,communicative,"the ideal candidate must posse good xxx skill , excellent time keep and"
1,respectful,"be treat in a warm , friendly and xxx manner that show genuine interest"
1,willing to travel,opportunity for a social worker that be xxx xxx xxx and stay during the
0,dynamic,the team be head by a team of impressive and xxx partner who like their associate to think outside of the
1,personal integrity,xxx xxx and credibility
0,dynamic,a team motivation and a desire to contribute to a xxx business strong plan and execution of plan skill
0,aggressive,to work a part of a small team to an xxx timescale and with strict attention to detail be essential be
1,discipline,"food science food technology engineer or closely relate xxx have a confident , practical and"
1,forward thinking,have an excite opportunity for a xxx xxx technical delivery consultant to join
1,accurate,provide direct nurse care when require maintain xxx individualise care plan for each
1,systematic and organised manner,good organisational skill work in a xxx xxx xxx xxx include prioritise and work
0,dynamic,"work with international advertise and medium agency , this xxx business represent some of the world 's best know brand"
1,judgment,the relevant information to make the correct xxx
1,take initiative,personal and sensitive information will to xxx xxx and be a change
1,critical thinking skills,"candidate should posse strong analytical skill , xxx xxx xxx and problem solve skill"
1,tolerance,site fit work to very tight xxx and to a very high
1,time management,and exist client extensive plan and xxx xxx
1,tactful but assertive manner,communication skill good negotiation skill a xxx xxx xxx xxx a good level of
0,dynamic,be currently look to recruit top closer to join our xxx sale team
1,diplomatic manner,face skill and a professional and xxx xxx flexibility to work outside in
1,monitoring skills,promote independence for customer administration and xxx xxx a full drive licence
1,results driven,"close attention to detail outgo , tenacious and xxx xxx even in hectic time"
1,willing to learn,a part of the team enthusiastic and xxx xxx xxx nvq level 2 professional
0,independent,", organise , selfmotivated and have the ability to be xxx problem solver"
1,interest to learn,good communicator and have a keen xxx xxx xxx about the next generation
1,self motivated,service we be look for xxx xxx and ambitious people to join
1,ability to adapt,have excellent communication skill have the xxx xxx xxx to different hospital environment be
0,dynamic,pro rata the university of east london be a xxx and rapidly expand university at the heart of europe s
1,discretion,to ensure appropriate use of price xxx work with internal supplier
0,independent,medium to large size service be part of a notable xxx provider of nurse home care and seek an accomplish manager
1,desire to learn,creative environment and if you have the xxx xxx xxx then this be the
0,dynamic,"formula win be a progressive , proactive and xxx medium recruitment consultancy dedicate to the medium industry"
1,motivated,under pressure strong team player who be xxx by team success excellent
0,dynamic,"have excellent track record within consultancy , they be a xxx partnership offer a personable yet professional service deliver by a"
1,learning and skills,"the plan , delivery and evaluation of xxx xxx xxx activity"
0,dynamic,client be a globally recognise retail brand recruit for a xxx and innovative regional train manager to join their rapidly expand
0,independent,my client be part of an xxx group and have high expectation form their staff and strive
1,correct reporting,xxx xxx of any security health safety
0,independent,"work in their location to provide their client with expert xxx advice and , with support from an establish company ,"
0,dynamic,production engineer require to manage creative medium service department of xxx agency
0,dynamic,microsoft gold partnerthis xxx organisation base in birmingham be look to add x
1,confident personality,you will need to have a xxx xxx a prove record of
0,independent,"the rapidly expand fuel and lubricant distributor be xxx and familyrun , with a history date back more than"
0,team working,job description you will be part of a xxx xxx on develop the current internal system and or incorporate new
1,problem solving abilities,an analytical approach and great xxx xxx xxx be also key
1,encouraging and facilitating innovation,one of the best in any industry xxx xxx xxx xxx and creativeness and people
0,practical,"repair equipment maintain sit and offer problem solve xxx advice , whilst provide excellent after"
1,personal time management skills,entail a high level of plan and xxx xxx xxx xxx
1,quality minded,"professional or domestic clean experience , be xxx xxx and a keen eye for"
1,ability to manage,skill and experience xxx xxx xxx project and deliverable development for
1,flexibility,"to suit our customer need , therefore xxx towards hour of work be"
1,detailed oriented,"excel , word and powerpoint must be xxx xxx have strong presentation and project"
1,analytical thinking skills,must be able to demonstrate xxx xxx xxx
0,independent,"selection deal with a wide range of group own and xxx hotel , restaurant and din pub black star to"
1,confident,you will need to be a xxx communicator with good draft skill
1,time management,"extract information from data source , excel , excellent xxx xxx good team player , organise and"
1,ability to plan,prove xxx xxx xxx and organise yourself and others
0,team working,you will be work a part of a successful sale xxx xxx to an average order value of k per sale
1,loyalty,include tiered customer incentive set up xxx and reward scheme work with
1,professionalism,"skill , work under deadline and interact with xxx and positive attitude towards coworkers"
0,dynamic,"environment , you ll hold the ability to demonstrate a xxx attitude of relentless determination to achieve customer satisfaction whilst be"
1,take initiative,door x configuration management xxx xxx in evaluate technical issue solution
1,communicative,"payroll knowledge would be advantageous but be xxx proactive , punctual , responsible and"
1,works collaboratively,people to manage their own health ' xxx xxx to tackle health inequality
0,independent,responsible for quickly establish the brand in both major and xxx retailer
1,tolerant,"you must be , reliable , xxx and determine and an empathic"
1,analysis skills,"skill documentation management strong communication , troubleshoot and xxx xxx ability to work a part"
1,encouraging innovation,"project , priorotising and manage team workload , xxx xxx and instill best practice"
0,dynamic,particularly around er and operational support within this busy and xxx consumer lead organisation
1,team work skills,use initiative passion for support learn strong xxx xxx xxx willingness to go the
0,dynamic,high degree of technical support and applicant must posse a xxx and application drive approach to the sale process
1,team work,include coordinate international freight and logistics xxx xxx work closely with
1,skills by participating in onthejob training,"maintain product knowledge , business and professional xxx xxx xxx xxx xxx xxx and classroom train share"
1,decision making abilities,confidence in xxx xxx xxx and deal effectively with unexpected
1,assertive,have arise for an organise and xxx hr manager to join
0,dynamic,"across the east of england , this forward think and xxx organisation be truly passionate about their people"
0,independent,a reception class at a high achieve all girl 's xxx school in enfield
0,independent,"environment , general practice , hospital , outofhours service , xxx practice or occupational health"
1,influencing skills,a retail environment excellent communication and xxx xxx passionate about drive sale ideally
1,research skills,a part of a team good xxx xxx and ability to present research
0,lively,our team be xxx energetic and hardworking and
0,dynamic,this be a forwardthinking organisation with a xxx culture and a burn desire to constantly push the boundary
1,conceptual skills,"quality , production plan , manufacture control plan , xxx xxx decision make , process improvement , verbal"
1,interpretation skills,prove analytical and data xxx xxx
0,dynamic,"accountant to join a business that offer an excite , xxx and fastpaced work environment , a culture of mutual respect"
1,delegation skills,"to communicate at all level good xxx xxx location nr baildon , essex this"
0,independent,"successful candidate will be expect to attract external fund for xxx research and foster collaboration in area such a genetics ,"
0,lively,europe or sunbathe on a beach we also have a xxx social agenda and work to ensure that our people progress
0,dynamic,green energy company look to maximise our growth in this xxx forward move market sector
0,dynamic,work with one of our client for an enthusiastic and xxx regional paediatric continue care team leader in the essex area
1,staff management,and circulate various performance report to xxx xxx
1,ability to interpret,polish of stainless balustrade essential xxx xxx xxx cad draw essential 4
0,independent,"to the hrd , this role will lead a small xxx team partner with senior management to implement the group wide"
1,availability,in a cover letter uk work experience xxx to work cv should
1,client relationships,and prove success in develop new xxx xxx
1,analytical,graduate who demonstrate a highly numerate and xxx approach
1,accurate,"duty include administration , copy type with an xxx speed of wpm"
0,dynamic,"they be a young , xxx organisation that have a strong reputation for deliver high quality"
1,respectful,challenge in a way that be xxx
0,independent,"experience particularly in the online environment would be beneficial highly xxx and a selfstarter , who be also an effective team"
1,polite,member handbook and offer service of a xxx efficient and professional manner
1,communicator,market knowledge of main healthcare system good xxx both verbal and write
0,independent,this home be an xxx care home provider with an excellent reputation in the area
0,dynamic,"experience create efficient , cross browser , xxx page use jquery and javascript"
0,independent,"with client range from local xxx business look for low cost , best value print giveaway"
0,independent,our client be a fast grow xxx asbestos consultancy provide a wide range of asbestos environmental service to
0,dynamic,company require a hard work selfstarter with a proactive and xxx approach and lot of energy
1,relationship builder,you will need to be a fantastic xxx xxx with an outgo personality
1,hardworker,level you will be ambitious great communicator xxx problem solver detail orientate
1,team building,"environment and culture through regular communication , xxx xxx and coach with the"
1,communication and interpersonal abilities,excellent xxx xxx xxx xxx be essential to this
1,selfconfident,"a software engineer , you must be xxx with the ability to"
0,independent,"the company the company be one of the largest xxx broker in the region , with gwp of over 15m"
0,dynamic,excite and vary role in a develop and grow and xxx company in the sme market
1,achieving their own goals,it way to support it team in xxx xxx xxx xxx
1,achiever,want to be our next high xxx call our manage director kate
0,team working,strong attention to detail an aptitude for problem solve and xxx xxx skill good communication skill a good telephone manner d
0,dynamic,"leadership and management quality be essential , a be a xxx and flexible approach to the role"
1,work ethic,"software developer , you must have a strong xxx xxx with a sharp eye"
1,management skills presentation skills,"essential skill project management , sale and account xxx xxx xxx xxx both write and oral excellent"
0,progressive thinking,have the opportunity to join a xxx xxx internationally recognise firm apply your
1,effectiveness,within operate budget and achieve cost xxx save where possible
1,motivated,the site manager will be highly xxx and be able to
1,works collaboratively,be very supportive and the department xxx xxx
0,dynamic,you will join the dutch country team in a xxx and international environment base in cork
0,followthrough,highly available database system analysis and xxx of application service problem against
1,openminded,the successful candidate must be xxx flexible and will to
0,dynamic,"establish in 2000 our client be a young , xxx and rapidly grow company in the freight forward industry ,"
1,analytical,this role require you to have excellent xxx skill and you must have
0,dynamic,involve with this role require an experience and xxx senior development manager within child school and family csf
0,dynamic,", this company be seek some new talent for their xxx and grow market department"
1,solution oriented,a strong ``hunting`` mindset commercial acumen xxx xxx approach to sell accurate
1,organisational skills,they will need to posse solid xxx xxx and be proficient in
