is_soft_skill,soft_skill,context
1,management skills,"analysis , negotiation , and financial analysis project xxx xxx ability to manage"
0,team working,to recruit an experience ward nurse to join a busy xxx xxx in surrey cover night shift
0,independent,association mba of the unite kingdom be an xxx research institute and scientific learn society carry out leadingedge research
1,ethical,they operate in a highly xxx manner and the company
1,maturity,"can demonstrate the skill , professionalism and xxx to lead assignment and"
1,diligence,project due xxx project option appraisal and procurement
1,customer service ethics,tidy work area at all timesawareness of xxx xxx xxx and expectation of meet
0,innovation,client have an unrivalled reputation for xxx and expertise
0,independent,"romford and the surround area to help our client remain xxx in their own home , provide various aspect of care"
0,independent,"above all , you ll need to be an xxx thinker , motivate by complex and difficult problem with the"
1,understanding understanding,"within a pharmaceutical or academic organisation thorough xxx of current issue in evidencebased medicine , include hta environment and a xxx of metaanalysis technique"
1,ability to anticipate,"aca , cima , acca with a prove xxx xxx xxx business performance issue"
1,professional manner,key skill experience act in a xxx xxx demonstrate and promote the
0,team working,"lead a project team of internal department member , the project manager will motivate"
1,results oriented,"solid think into action along with flexible , xxx xxx entrepreneurial and selfmotivating , global mindset ,"
1,client facing skills,"you be keen and eager , have good xxx xxx xxx and want to progress"
1,communicative,you will be articulate and xxx with a range of
0,schedule,enable plan signoff within the overall business xxx programme resource plan keep
0,independent,"euro london appointment , the uk 's largest xxx language consultancy , be act a an employment agency for"
1,self starters,look for they like people who be xxx xxx with a can do
0,competitive,continue plan for expansion a xxx salary and benefit
0,dynamic,you will be part of a xxx management team responsible for drive business strategy and process for
1,decision making skills,ability to communicate at all level good xxx xxx xxx with an ability to
1,leadership,"home manager responsibility provide xxx to the home , manage all"
0,dynamic,"great opportunity for a ato to join a team of xxx audiologists , cover a full range of competency within your"
0,team working,consultancy take full control of an establish and successful survey xxx xxx on long term contract within the railway industry
1,creative in your approach,"well a this , you will be xxx xxx xxx xxx to your work and"
1,quick learning skills,"strong communication , presentation and organization skill xxx xxx xxx able to work under pressure"
1,public relations skills,excellent communication skill both write and oral xxx xxx xxx excellent management and organizational
1,household tasks the skills,provider have the ability to identify xxx xxx xxx xxx to guide young people
0,dynamic,for one of the world s largest and most xxx medium business would you like to work a part
1,presentation skills,of seo strategy and best practice strong xxx xxx highly analytical and datadriven excellent
1,facilitation skills,"the entire project delivery lifecycle strong workshop xxx xxx which will involve interview stakeholder ,"
0,lively,an eyecatching xxx restaurant in london be look for a senior chef de
0,dynamic,"a successful candidate will be a proficient user of xxx process simulation software , hysys or unisim , and experience"
1,punctuality,"the company goal by maintain regular attendance , xxx focus and professionalism at"
1,development excellent communication skills,test experience familiar with object orient xxx xxx xxx xxx experience work within a financial
0,independent,i be work with an xxx foster agency who be look for a supervise social worker
1,conceptual skills,creative and posse excellent design and xxx xxx in combination with indepth knowledge
0,independent,the successful xxx review officer will have experience of independent review work independently
1,prompt,"staff , information and resource to enable xxx detection of leak or consumption"
0,nice,or digital sector experience be a xxx to have but not essential
1,proposal writing,most suitable option to be offer xxx xxx and presentation at board level
1,communications skills,"strong project management and excellent interpersonal and xxx xxx to consult , negotiate and deliver"
1,self learning,be proactive around xxx xxx and train and work
1,professional personality,you must have an engage and xxx xxx a genuine depth breadth of
1,patience,of practice and the national curriculum have xxx understand and empathy the
0,dynamic,"targetfocused , selfmotivated and xxx well present"
0,independent,broker dealer selby jennings my client be an xxx asset management firm locate in the cayman island
0,dynamic,"you will join a xxx team of quantitative geneticist , bioinformaticians , computational biologist ,"
1,ability to communicate,"technical issue to non technical user , xxx xxx xxx at all level of the"
1,ability to travel,synthesize complex issue into simple message xxx xxx xxx within europe and internationally team
1,commitment to accountability,to work a part of a team xxx xxx xxx transparency and knowledge share commitment
0,independent,new site will house up to apartment to offer xxx live for older people ideally locate for good transport link
1,advocacy skills,of bill of cost detail assessment with xxx xxx negotiation of cost negotiate
1,customer focus self development and interpersonal skills,"key competency require be listen and xxx xxx xxx xxx xxx xxx xxx problem solve integrity , trust , ethic"
1,courteous,point of contact in a professional and xxx manner organise contract and
0,aggressive,", and face to face and be a confident and xxx prospector able to work independently and remotely from home"
1,initiative,"a team and also use your own xxx enthusiasm , motivation and a"
1,ability to analyze,"database structure , theory , principle and practice strong xxx xxx xxx user requirement and build"
1,ability to negotiate,be a top performer with a prove xxx xxx xxx
0,independent,my client be a lead xxx provider of it solution and service together with output solution
0,dynamic,in a mobile telecom role be a huge advantage must be xxx and hungry for success with excellent negotiation and close skill
1,organized,ability to work in a highly xxx manner a smart and
1,disciplined,to operate in a highly charge multi xxx environment and meet the
0,dynamic,ph in touch recruitment be work on behalf of a xxx care home provider to recruit a motivate rgn to begin
0,dynamic,"sale person either from facetoface or on the phoneconfident , xxx and presentableprevious experience to seel to md 's , senior"
0,team working,"applicant must have excellent people , xxx xxx and organisational skill and have knowledge of hygiene ,"
0,enthusiastic and keen to learn,you outstanding facility student who be xxx xxx xxx xxx xxx very supportive colleague excellent
1,sensitivity,be respectful posse cultural awareness and xxx be flexible in the
0,dynamic,record of success within field sale and a positive and xxx nature
1,administrative skills,"communication skill excellent time management , organisational and xxx xxx commercial awareness ability to"
1,ability to motivate,"disease along with team lead skill the xxx xxx xxx and provide technical coach , manage"
1,people management,"knowledge in effective train , coach and xxx xxx practice , include leadership development"
0,independent,nurse guild be one of the uk s lead xxx nurse agency supply all aspect of the uk health care
0,independent,installation engineer our client be a large xxx security provider specialise in offer multidisciplined integrate security solution to
1,organizer,communicator with peer and subordinate good xxx to be hand on
0,dynamic,"under the xxx leadership of the headteacher , the school have see good"
1,professional personality,"customer service skill confident , friendly and xxx xxx with a proactive and enthusiastic"
0,dynamic,for your action experience of work in a flexible and xxx environment and be able to work shift
0,dynamic,"team to operate the venue the person drive , xxx and servicemotivated character have true entrepreneurial flair passionate about provide"
1,eager to learn,"genuinely interest in technology , be innovative , xxx xxx xxx and posse the communication skill"
0,dynamic,lead the team in a xxx and inspirational manner
1,dedication,experience work in a pressurise environment a xxx to target achievement a selfmotivation
0,independent,"ensure design be adequately check , sign off include any xxx check and design certificate"
1,interpersonal skills,record of have do so good xxx xxx with the ability to influence
1,leadership,but not limit to management and xxx of plan team liaise with
0,ambitious,business class manager to drive an xxx programme of school and business
0,independent,"to sector information technology cdl be a lead xxx software house supply system to the insurance industry , currently"
1,leadership skills ability,technical community and vice versa excellent xxx xxx xxx to set own workload and
0,dynamic,win digital social medium agency look to recruit a xxx senior account manager to look work on lead account across
1,leadership ability,track record in your coach and xxx xxx you will have the
1,people management skills,"a diverse clientele excellent time management and xxx xxx xxx be strong leader , professional and"
0,dynamic,move and be interest in the prospect of join this xxx and entrepreneurial team
1,self motivation,"excellent analytical skill and problem solve , xxx xxx and posse an enquire mind"
1,leadership ability,qualify and or a gmtc qualification strong xxx xxx and able to lead by
1,client service oriented,"prioritise and meet deadline strong interpersonal skill , xxx xxx xxx and resilient conscientious , selfmotivated and"
0,independent,"they be the only xxx investment bank organisation to regularly advise on industry transform ,"
1,personal management,nbsp nbsp nbsp self starter with good xxx xxx skill
1,self discipline initiative,maker at all level plan time management selforganization and xxx xxx xxx proactive and able to work
1,be creative,you will xxx xxx with the ability to motivate
0,dynamic,"job description work in a fantastic , professional and xxx kitchen that be aa rosette rat , you will"
0,dynamic,"think , enthusiastic , creative sou chef to join our xxx brigade , in this well establish country house hotel"
0,achievers,and make your first esynergy high xxx 'lunch club' to have fully
1,schedule,coordinate with the development team to xxx release of software update
1,communicative,on own initiative assertiveness high analytical and xxx competence ability to influence
0,independent,"sit , we be one of the uk 's largest xxx steel stockholder"
1,ability to persuade,xxx xxx xxx and influence to the
1,multitask oriented,communication skill and problem solve ability xxx xxx able to inspect your own
1,problemsolving skills,a reputable company have strong analytical and xxx xxx be personable and diplomatic
0,dynamic,this be a xxx role where you will have the opportunity to utilise and
0,dynamic,will be look for in you this excite and xxx management role will require a selfmotivated individual with a positive
1,for multitasking,the php developer will be responsible xxx xxx several web base project at
0,independent,"functional and the area network , provide an xxx appraisal of the adequacy and effectiveness of risk management and"
0,independent,"west midland mid wale k commission a well establish xxx manufacturer of commercial litho print , this client posse excellent"
1,sharp,the successful sale candidate will be extremely xxx hungry and drive by the
0,dynamic,my client be offer a fantastic opportunity for a xxx and proactive individual to join there team network a a
0,dynamic,be a lead global cosmetic brand look to recruit a xxx national account executive
0,dynamic,international group with a outstanding reputation for excellence and a xxx and creative cut edge company ideal candidate the ideal general
1,team member,and rail pressure control description engineer xxx xxx responsible for obd and rail
1,ability to communicate,must have the xxx xxx xxx with the general public similiar
1,sensitivity,"external agency to demonstrate politeness , courtesy and xxx maintain confidentiality of information"
1,initiative person,work independently act on your own xxx xxx specification the successful applicant
1,diplomacy and interpersonal skills,to a very high standard strong xxx xxx xxx xxx able to influence across
1,team work,excellent communication skill and a strong xxx xxx ethic
1,results orientation,competence communication skill adaptability focus on customer xxx xxx
1,independent worker,structure personality we be seek an xxx xxx who be self motivate with
0,dynamic,a well a the opportunity to be part of a xxx and visionary company
1,managing the tasks,"divising and follow the project plan and xxx xxx xxx resource , risk and all"
1,take the initiative,background and attribute the successful candidate will xxx xxx xxx and ownership of all
0,dynamic,"to display gravitas , professionalism but above all a very xxx and proactive outlook to business development"
1,attention to details,xxx xxx xxx and able to efficiently
1,innovative,pa we seek an xxx researcher to work with u
1,autonomy,of the leadership team and have the xxx to grow the business throughout
0,dynamic,high level of customer service in one of the most xxx and fastest grow organisation in the uk
1,team with a commitment,ability to work a part of a xxx xxx xxx xxx to share and work
1,motivated,engage and personable target drive and money xxx confident with excellent communication
1,quick to learn,"use of microsoft word , excel and outlook xxx xxx xxx new system able to work"
1,sociable,restaurant new movement in all day din xxx good communication if you feel
1,enthusiastic personality,"and deliver a strong sale strategy positive , xxx xxx with a passionate desire"
1,managerial and leadership skills,rmn management qualification posse strong xxx xxx xxx xxx with the ability to
1,collaborative,with the wider leadership teamyou willbuild xxx relationship that support change and
0,dynamic,school be look for a y1 teacher to join their xxx and friendly team
0,honesty,"our value be xxx integrity , passion , and flexibility ,"
1,proposal writing skills,be a must good presentation skill xxx xxx xxx exposure to write proposal and
1,tolerance,"prototype through to production , include design and xxx modification a strong track record therefore"
1,to write,"you will be able xxx xxx pithy , relevant and actionable summary"
0,dynamic,"company have create some amaze new opportunity for talented , xxx and creative people look to join them on this incredible"
1,learning disability skills,value the right of people with a xxx xxx xxx able to work well a
1,development skills,deal effectively with demand client good business xxx xxx and local contact substantial experience
1,skills in the training,ass the learner s technical competence and xxx xxx xxx xxx centre and in company
1,people management skills,"plan , report , issue risk management and xxx xxx xxx knowledge and experience of"
0,dynamic,excite opportunity have arise to work within a trendy and xxx architectural firm specialise in high end retail
0,dynamic,"company culture be xxx and open , this role be offer an opportunity to"
0,dynamic,i be currently recruit for a revenue manager for a xxx and successful international hotel group
1,team working,be a vibrant and well balance xxx xxx with a wide variety of
1,detailed oriented,a plus you need to be xxx xxx positive attitude ability to
0,dynamic,"return , you will be reward by work for a xxx and grow organisation , with superb benefit include generous bonus"
1,writing skills,excellent report essay xxx xxx
0,progressive and forward thinking,service work a part of a xxx xxx xxx xxx team experience require min
0,honest,your gscc registration excellent rat of pay xxx and personal service from
1,conceptual thinking,knowledge of the automotive industry presentation skill xxx xxx ability to come up with
1,personal management skills,motivate individual who posse excellent communication and xxx xxx xxx
1,tolerant,"pragmatic , xxx of ambiguity , will to backtrack"
1,versatility,"this will require someone who demonstrate xxx and energy , with a"
0,dynamic,"technology through education and or experience , combine with a xxx personality and excellent people skill"
1,ability to travel,interpersonal and diplomacy skill combine with the xxx xxx xxx and juggle a vary
1,motivation,"region would be advantageous lot of drive , xxx and strong business development"
1,sympathy,applicant must be in xxx with the work of the
1,counselling skills,business posse strong network and client xxx xxx capable of provide robust
0,dynamic,"you will be xxx in your approach , ambitious , self motivate and an"
0,independent,"qualify nurse , to work for a well know lead xxx hospital"
1,positive cando attitude,"skill , be a team player with a xxx xxx xxx"
0,team and work,a night shift manager to join this xxx xxx xxx on a permanent night shift
1,progressive forward thinking,your career into the fast lane a xxx xxx xxx company where success be the
1,communicating and writing skills,"any level good eye for detail , excellent xxx xxx xxx xxx be able to grasp complex"
0,dynamic,they be currently on the lookout for a xxx and drive sale executive to join the team
1,team members work,"of the yard and drive team , ensure xxx xxx xxx in an accurate and efficient"
1,innovativeness,will be use your creativity and xxx to develop the company s
1,ability to persuade,success will come from the xxx xxx xxx these contact into understand the
0,independent,"sector , and you will understand the importance of maximise xxx live and quality of life"
1,development skills,beneficial experience deal with endusers stakeholder beneficial ux xxx xxx beneficial this be the perfect
0,dynamic,for a dedicate medium payable to join their lively and xxx team on a temp to perm basis immediately
0,dynamic,by ofsted last year and want to bring on a xxx teacher to join a great team environment
1,ability to negotiate,verbal communication skill and have the xxx xxx xxx and come to a
1,conceptualization,"demonstrate proficiency in project management from xxx spec write , plan , schedule ,"
0,dynamic,"base wakefield , flexibility to travel overview a xxx and rapidly expand property company be look for a property"
1,able to persuade,have to deal effectively and be xxx xxx xxx and influence many class
1,energetic,xxx personality and flexible regard
1,to write,combine package insurance and be able xxx xxx new and exist business
0,dynamic,our client be a grow and xxx financial service provider look to strengthen it forward think market
0,human relations human relations,head of business strategy and xxx xxx management up to k basic plus car and significant benefit stockport we be look to appoint a head of business strategy and xxx xxx management
1,communicate easily,learn and work in a team and xxx xxx up and down the
0,aggressive,provide our client with the competitive edge in an increasingly xxx marketplace
1,listening and questioning skills,skill both verbally and write excellent xxx xxx xxx xxx excellent organisational skill good
0,independent,hertfordshire k to start our client be a large xxx residential block manage agent with regional office cover the whole
1,energetic,we be look for xxx and enthusiastic individual to
0,dynamic,with a strong reputation in the local area and a xxx management team who be look at grow this reputation further
1,attentive to details,you have a fast type skill and xxx xxx xxx
1,language skills,must have good english xxx xxx
1,ability to travel,relationship at all level have the xxx xxx xxx maintain a relentless drive for
1,active,"write experience in microsoft sccm , server xxx directory experience or"
1,organization skills,environment knowledge of relevant manufacture process xxx xxx maintain s process
1,ability to anticipate,demonstrate xxx xxx xxx future workforce need and to
0,lively,"market company be recruit want some fun , in a xxx environment whilst build a career if so , then"
1,multitasking skills,skill and capability excellent organisation and xxx xxx obsession with deliver great
0,independent,"enable child , adult and the elderly to remain a xxx a possible"
1,analysis services skills,xxx xxx xxx would be beneficial but be
0,dynamic,you will be work a part of a xxx busy software development team your key duty will require
1,problemsolving skills,class customer care ethos natural xxx xxx high stamen to
0,aggressive,career opportunity to join a market leader that have an xxx growth strategy for the emea region
1,punctual,learn hard work reliable conscientious good communicator xxx
1,mentoring skills,"strong leadership , communication and xxx xxx be also require"
0,dynamic,"education , law and social science be a large and xxx faculty with over student and staff engage in"
0,dynamic,bba reman have a very xxx environment and one day be rarely the same a the
0,independent,a highly establish forward think xxx agent be look to recruit an experience sale administrator to
0,independent,and improve the efficiency of the audit operation provide reliable xxx assurance over the company 's worldwide operation provide solution with
0,lively,highcaliber handson account director to bring senior expertise to this xxx agency
0,dynamic,"seo , affiliate , display behavioural , retargeting , xxx creative , engagement map , dsps and dmps"
1,courteous manner,"contact in an effective , efficient and xxx xxx"
0,dynamic,"the role offer an opportunity to be involve in a xxx and proactive support environment , work a part of a"
1,eager to learn,"be focus , with an excellent telephone manner , xxx xxx xxx and be able to"
1,computer skills,role and require someone who have strong xxx xxx word and excel and
1,mentoring skills,xxx xxx excellent analytical and problem solve
0,dynamic,", drive and develop strategy to build a capable and xxx team and deliver profitable sale growth you be look for"
0,dynamic,"setup , deployment , html cod , set up for xxx content , personalisation and email test"
0,independent,"manager contract cater education read 30 , 000 my client be an xxx cater company who have a very good reputation within the"
1,attentive,"a great personality and be genuine , approachable , xxx and instinctive to enjoy"
1,client handling skills,ability to client counsel strong xxx xxx xxx you 'll be an excellent
0,dynamic,"polish , knowledgeable and ambitious audit manager to join a xxx team and genuinely fast track their career"
1,polite,respond to all customer enquire in a xxx and timely manner work
1,ability to anticipate,for an assign portfolio of receivables debtor analysis xxx xxx xxx implication of activity level on
1,client service orientation,"responsiveness , client satisfaction , effective client communication and xxx xxx xxx"
1,hard working sales person,keen to find an experience and xxx xxx xxx xxx who can focus on obtain
1,dedication,individual who will still have the xxx and willpower to make
0,independent,"we be an xxx website design and web database consultancy base in gloucestershire ,"
0,independent,assist their development enable them to become successful and xxx and in turn become business mentor themselves
0,dynamic,they be seek a xxx and experience european road freight sale professional
1,self directed,"ld , pd , op and hospital perform xxx xxx support assessment review home"
0,dynamic,travel managementstrong analytical and organisational skill be neededyou will be xxx and proactive in your sale approach with a real desire
0,proposal writing,rfi rfp bid xxx xxx
0,team working,you will be responsible for lead the clinical and staff team to ensure both professional standard and effective xxx xxx be
0,independent,"for over 30 year , this client be a lead xxx supplier of bespeak product and solution to the fmcg sector"
1,team spirit,consistently high standard build a strong xxx xxx ensure kitchen hygiene standard
0,team to work,"further mechanical maintenance engineer to the exist xxx xxx xxx on a day ,"
0,independent,"our client be one of the uk 's lead xxx cater company , serve highquality , freshlycooked food to thousand"
1,ability to buy and sell,retail and child care voucher and the xxx xxx xxx xxx xxx annual leave entitlement
1,educational and social skills,aim to assist them in develop their xxx xxx xxx xxx in a bespeak and understand
1,analysis skills,"production rout , work instruction very good data xxx xxx by use statistical tool strong"
1,quick to learn,they would be computer literate and xxx xxx xxx new skill
0,dynamic,"car owner and driver personal attribute a savvy , xxx and intellectual individual ability to develop , foster and maintain"
1,team builder,aptitude and personal characteristic essential xxx xxx and motivator proactive and
0,independent,compliment an already exist branch network of this well establish xxx brand
1,willingness to learn,a xxx xxx xxx new skill a require
1,articulate,demonstrable ability to xxx and present use effective write
1,strategic planning,include define and build system and xxx xxx and documentation for the client
1,self starter with initiative,"external customer initiate change highly motivate , a xxx xxx xxx xxx and capable of work with"
0,dynamic,"highly presentable , xxx and well organise , target drive and hungry for sale"
1,problemsolving skills,"or above excellent communication , presentation and xxx xxx"
